[
  {
    "id": "2305843010159177973",
    "portalId": "2305843009928936739",
    "shortId": "DAR-6",
    "title": "1",
    "description": "qdw",
    "category": {
      "id": "2305843009943746454",
      "name": "1"
    },
    "status": {
      "id": "2305843009928936743",
      "name": "New"
    },
    "internalStatus": {
      "id": "2305843009943114957",
      "name": "Not a Priority"
    },
    "importance": {
      "id": "2305843009928936757",
      "name": "Nice to Have"
    },
    "creationTime": "2022-06-16T17:06:30.000Z",
    "createdBy": {
      "id": "2305843009550306942",
      "name": "John Doe"
    },
    "owner": {
      "id": "2305843009550306943",
      "name": "Jane Doe"
    },
    "labels": [
      "Label 1",
      "Label 2"
    ]
  }
]